{
  "id": "igc.checkpoint:24270bad4a",
  "status": 0,
  "status_label": "success",
  "message": "checkpoint e09b4be + wal c6813cff223921d2",
  "checkpoint_ref": "e09b4bea047bad7aa31ea96a3c53685dfbce3dc2",
  "wal_hash": "c6813cff223921d2",
  "wal_entries": 190,
  "state": "EXEC",
  "classe": "FIX",
  "registry": "github-actions-docs-skill",
  "tag": "[igc-checkpoint]",
  "addenda": [
    {
      "kind": "checkpoint",
      "path": ".session/CHECKPOINT"
    },
    {
      "kind": "log",
      "path": ".session/WAL.md"
    },
    {
      "kind": "config",
      "path": ".igc-registry.yml"
    }
  ]
}
